{
    "$schema": "http://json-schema.org/draft-07/schema#",
    "$id": "schemas/gconfig/gameConfig.schema.json",
    "required": ["enemies"],
    "type": "object",
    "properties": {
        "options": {
            "$ref": "definitions/options.schema.json#/definitions/options"
        },
        "enemies": {
            "$ref": "definitions/enemies.schema.json#/definitions/enemies"
        },
        "player": {
            "$ref": "definitions/player.schema.json#/definitions/player"
        },
        "components": {
            "$ref": "definitions/components/components.schema.json#/definitions/components"
        }
    }
}